video_id,comments
SVtRsDhHlDk,"[""Thanks for watching everyone! Obviously I'm back to data science now, but this was a very interesting short term career pivot for me. I hope that this video helps you to better understand what goes into making a career decision. I also hope that you enjoy my admittedly weird sense of humor, dinosaurs, and papayas. \n\n\r\nTry watching these next:\r\nWhat is the #66DaysOfData: https://www.youtube.com/watch?v=qV_AlRwhI3I&ab_channel=KenJee\r\nHow I would learn data science in 2021: https://www.youtube.com/watch?v=41Clrh6nv1s&t=1s&ab_channel=KenJee\r\nI Built a Leaderboard for my Subscribers: https://www.youtube.com/watch?v=myhoWUrSP7o&ab_channel=KenJee\nTry"", ""I moved from mechanical engineering to project management about a year ago. What's your describing? Sounds like a very similar experience. It's been less than I deal to say the least. I'm now looking into a career shift into data science."", 'Some people call it “Selling out.” I call it “Getting paid what you’re worth.”', 'Did Cyber security is better than Data Science jobs?', ""I'm a 1st year students majoring in CSE(Data science) I'm really confused or have no idea to choose project. I really wanna work on some project but don't know where to begin or how to do? It'd be grateful if you could help me regarding this."", 'Ken ı guess it is little hard to try out different roles Most of the companies looking for ""experieced in the title"" roles. Even if for example, I would be a great product owner or product manager, sisnce my title is system engineer, when HR sees that title, they say nahh, we need ""in title experience"" individual. I guess If someone can swith role, it is also ""ı guess"" chance factor is really important.', 'MBA or data science which is best???', ""Thanks for making this video ken. I am just trying to break in, but turns out ,there's much more to life."", 'As a person who has left a very technical role in a small fast startup to a bigger, corporate-like env, I can truly relate to you. All I do is to do project scoping for data science projects, framing the models to the business use cases, and watch vendors do the fun data science stuff. I kind of miss the hustle in the startup though. I guess life is not perfect.', 'you sounds like pat bateman']"
OtqQYqRNDGI,"[""Thanks for watching my video everyone! Hopefully it burns the concept into your memory (HA). I know I won't forget making this one 😭!"", 'what a guy 🤣', 'LMAO! The tears! 😂', 'Unique data science explaination 😂', 'That seemed spicy🥵', 'WHY the habaneros?!! 😭', 'omg , why did you do that.', 'Wow\nHe is so passionate about data science that he started crying.', '😂😂\nbrilliant!', 'why do you have to put yourself under such pressure!!! 😂😂']"
uic34RTaI-w,"['Thanks for watching everyone! Hope these tips helped you out! As a reminder all the tips, tools, and summaries are in the description! \nCheck these out next:\nMy podcast - https://www.youtube.com/channel/UCpEJMMRoTIHJ8vG8q_EwqCg\n#66DaysOfData - https://www.youtube.com/watch?v=qV_AlRwhI3I&ab_channel=KenJee\nLeaderboard Project - https://www.youtube.com/watch?v=myhoWUrSP7o&ab_channel=KenJee\nMy Pillars for success - https://www.youtube.com/watch?v=jf3j0lWmFPU&ab_channel=KenJee', 'Thanks a lot ken. This really helped me out a lot.', 'Just started reading book One Thing as per your advice. Thanks for great content .', 'Another helpful video! Keep up the good work ken!', ""Finally, I got to know that the sleeping old man in the end of your videos is your dad. Initially, I thought it was an edit or something.  But the sleeping man finally talked 😂😂😂. And yeah YouTube recommending your old videos and I can't help myself and watch these."", 'Learning aside... I come to this nearest neighbor just to unwind sometimes... content is therapeutic in its own kind of way.', 'It is really good that you are verifying the quality of brands because we are in search of good sources and it shows your honesty towards your audience.', 'These are much-needed techniques to manage my time efficiently...', 'These are great tips. I need to incorporate some of these!', 'please sir make a video on cloud computing required for data science']"
GO420aMtHfk,"['Notebook 1: https://www.kaggle.com/kenjee/kaggle-project-from-scratch\r\nNotebook 2: https://www.kaggle.com/kenjee/analyzing-gender-and-earning-potential-in-tech\n\nPart 1: https://www.youtube.com/watch?v=r-DR9HBaipU&ab_channel=KenJee\r\nPart 2: https://www.youtube.com/watch?v=KQ80oD_boBM&feature=youtu.be&ab_channel=KenJee\r\n\r\nTry watching some of my other project videos as well: \r\nLeaderboard for my subscribers: https://www.youtube.com/watch?v=myhoWUrSP7o&ab_channel=KenJee\r\nBeginner kaggle walk through: https://www.youtube.com/watch?v=I3FBJdiExcg&ab_channel=KenJee', '25:32 Be ready to be boycotted by 14 year old white girls! XD', ""Just discovered your channel - love this series. I've yet to dive into Kaggle but I suspect that is my weekend sorted now (BTW - if you want to go deeper into Plotly check this channel out - this guy is amazing - https://www.youtube.com/c/CharmingData)"", 'lol my guy @Ken Jee you are so tired at the end hahaha', 'Learned a lot from this Project, Thanks a lot, Ken.👍', 'Top content', 'Thank you my friend for these insightful tutorials. Could you please recommend a link for dirty datasets that one can exercise cleaning on them?', 'Hi, ken, \nCan you suggest to me how can I build my profile for a data science masters? What things should I do as I have one year with me?\nI will be a great help!', ""I press like even i'm not finished watching this video👍"", ""damn this is boring...no offense mate, I'm sure the learning is great, but I was interested in whta data scientists do, as I'm a just finish law degree and will probably go onto IP/ICT Law masters here in the UK, so was thinking if I could somehow mix it with data and become a data protection solicitor - mostly about GDPR and then the IP with it so like trademarks, copyrights, designs...but now seeing how boring data science is (even for a coder like myself), I wouldn't enjoy doing this. Prolly will switch back to international commercial law xD""]"
KQ80oD_boBM,"['Follow along here (kaggle notebook): https://www.kaggle.com/kenjee/kaggle-project-from-scratch ! \nPart 1: https://youtu.be/r-DR9HBaipU\nWatch These Next! \nWhat is 66 days of data? https://www.youtube.com/watch?v=qV_AlRwhI3I&t=6s&ab_channel=KenJee\r\nProject from scratch: https://www.youtube.com/playlist?list=PL2zq7klxX5ASFejJj80ob9ZAnBHdz5O1t\r\nTitanic Kaggle Project: https://www.youtube.com/watch?v=I3FBJdiExcg&ab_channel=KenJee', 'As a person who barely understands anything at all about data science, this video is extremely informative in that you explain your thinking process and methodical approach.', ""Great video as always. It's great to see someone do it from scratch."", 'please provide the link of dataset you are using', 'Thank you for these', 'Hey Ken, thank you for creating awesome playlists. I have never come across a video with a detailed explanation of how to approach data science problems. And your videos are such a lifesaver!!!', '20:06: Dat stats PUN! hahahahaha XD', 'man...you are a legend..I wanna get into data science..I had loved this field since i was literally 8 years old, I always loved to keep stock of all my stuff, toys, books etc, i started with maintaining a work book on my notebook, even though i barely knew how to write lol, and then i started using MS Access, Loved it so much as a kid, it was mostly DBA than data science though, until I started watching a lot of football, tennis etc, try and analyse the data from each match and started to build etc etc yk how it goes and today about a decade later, I am super interested in the field.. I know basic Python, R, Power BI, MS Analysis services, etc etc, But i wanna know a how to get self taught a good path to follow, hope anyone could point me in the right direction, thank you..', '9:28 why do we have to use dict.fromkeys() ?', 'Yeah plotly is pretty nifty, but I have a hard time understanding the logic of how to do things past the more basic plots because the documentation can be a little lacking when trying to customize something. I did some poker analysis using plotly and can understand the struggle.']"
r-DR9HBaipU,"[""Thanks for tuning in everyone! Get ready for part 2 coming 1/8! If you can't wait till then, I recommend checking out these other projects that I've done:\nMy Channel Leaderboard Project: https://www.youtube.com/watch?v=myhoWUrSP7o&ab_channel=KenJee\nBeginner Titanic Kaggle Walkthrough: https://www.youtube.com/watch?v=I3FBJdiExcg&ab_channel=KenJee\nProject From Scratch Series: https://www.youtube.com/watch?v=MpF9HENQjDo&list=PL2zq7klxX5ASFejJj80ob9ZAnBHdz5O1t&ab_channel=KenJee"", 'This answered a lot of questions on how to approach a project on Kaggle. Thanks.', 'Great video Ken , I will code along. I seriously need to learn about APIs.', 'Love these videos! Would love to see you do more project walkthroughs Ken!', 'Very good introduction on Kaggle. Truly learning by doing! I like that approach.', 'Thanks for the vid ! nice ! \nI have a question apart. I did a dual boot windows/Ubuntu. But i want to switch 100% on ubuntu. Is it possible or i may loose my computer doing that ? (BTW do you have any tutorial for that) ?', 'Awesome! Thanks', ""This is really comprehensive. All from scratch, that's what i wanted . thanks ken"", '00:50 ""It\'s nice for me to say that you should learn certain things or do certain things, it means a lot more if I can legitimately back those statements up with data.""\nMuch appreciated.', ""I wish you'd been creating videos like this when I was learning data science! It would have saved me so much fretting and time.""]"
qV_AlRwhI3I,"['Thanks for tuning in everyone! I hope you will join me for the challenge! \n\nLearning Resources: \r\nhttps://www.kaggle.com/\r\n365 Data Science: \r (20% off Monthly) https://365datascience.pxf.io/Wno9O or (47% off one year) https://365datascience.pxf.io/JG3yR (Disclaimer - Affiliate Links), If the discount doesn\'t work use promo code ""knn""\r\nhttps://www.nvidia.com/en-us/deep-learning-ai/education/\r\n\r\nCommunity Resources:\r\nMedium Writeup: https://towardsdatascience.com/why-im-starting-data-science-over-21bec8036ce9\r\nOriginal Video: https://www.youtube.com/watch?v=uXLnbdHMf8w&ab_channel=KenJee\r\nDiscord Server: https://discord.gg/4p37sy5muZ\r\nNotion Template (Via Ashley): https://www.notion.so/66DaysOfData-86145f47abde44e6ac30dbf484f3734c\r\nGithub: https://github.com/66daysofdata/Resources\r\nThinam\'s Journey: https://github.com/ThinamXx/66Days__NaturalLanguageProcessing/blob/master/README.md\r\n\r\n@Tina Huang\'s channel - https://www.youtube.com/channel/UC2UXDak6o7rBm23k3Vv5dww\r\n@Andrew Mo\'s channel! - https://www.youtube.com/channel/UC23emuGbNM7twofQIrEgPBQ', 'Day 3!! Loving it so far!', 'Am just starting my data science journey, this will get me to learn daily before my masters begins in June 2022.', 'Very insightful video. Thank you for starting something so helpful. One question though, is this limited to just Data Scientists? Can other data professionals E.g Analytics Engineers and Data Analysts, join?', ""Thanks Ken for the video; I'm really thrilled to get started on this adventure, and thanks for providing such an excellent starting point 🔥"", 'This is awesome! Excited to start!', 'Are you starting again this January? :D I just got to know about this initiative and I am going to start today :D', ""Hi Ken,\nI'm Blaise one of your follower in youtube. All your Video are so many helpfull. My company facing now with inventory problem. I'm wondering if I can implement Object detection tracking/ counting to Increase the speed and the Accuracy of Inventory?  Could you give some advise about?\nThank you"", 'This might be a dumb question. But what does all the math help with in data science? Also I hear a lot of reading papers or professional documentation that requires math or something?  Im a bit confused', ""I came here from Tina's channel. I am just seeing this video now that I am about starting on my data science path. Anyway, my 66 days starts now""]"
41Clrh6nv1s,"['Thanks', '@Ken Jee\xa0 what are the topics for Stats amd maths that are just enough to get started?', 'Thank you very much for your explanation. I think it can be helpful to have groups of 3 to 5 persons in which you can work together on projects.  In this way, you can learn from others and have the motivation', 'I recently started following you. I am terrible at Stat. I have this fear. But with this I am ready to face it heads-on. Thank you for speaking to me. I will start my Journey today', 'can u help me by tell me what is the most important model/topic in machine learning do I have to learn for data science ?', 'what are some sources to learn stats and algorithims?', ""Has anyone looked at the MS in Data Science from Eastern University? I was looking into it but I'm not sure about its quality. Any feedback is appreciated."", 'what do you think about datacamp?', 'Normal people: ""Frustration""\nMe, as a soft. Engineer: ""Routine""', 'Im doing data analytics at university, but I just hate the structure and stress of school, is it genuinely fine to learn data science by myself or should I stick to it?']"
YR9Faf1uZDg,"['Hey Ken! I am almost finishing my university degreed in market research & marketing and I am going to focus in data science/data engineering. Currently my friends are telling me to buy a M1 Macbook but I am not sure about compatibilities with OSX and I am not familiarised with Macs (I have always being a Windows user). Do you think it is a good idea or is it better to stick with this Zbooks or any other similar Windows laptop?', 'Can you review the new Z desktops for data science?', 'How can we become one?', 'I think it is about this laptop you were talking about in yt leaderboard video, thankfully I have found your channel early enough to get a chance of winning this and this motivates me even more to pursue data science as I will be able to watch your videos then and maybe win this amazing laptop as a byproduct alongside the knowledge I will gain studying data science', 'The StatQuest gear... yaaaaassss.', 'I see you use Spyder IDE at about 0:58. The data science stack includes PyCharm and VS Code. Which you do you like best? I am still deciding between Spyder and VS Code.', 'Yo my dad works for tableu and they lookin for sponsors you should hit them up', 'Loving your new videos Ken. Keep doing good work.', 'Congrats on the play button, Ken! You are def one of the coolest YouTube channels out there. Great content.', ""7:02 it's a pretty great mouse.\nWhere did you get it from?😂""]"
myhoWUrSP7o,"['Thanks for watching everyone! The Leaderboard: https://share.streamlit.io/playingnumbers/youtube_leaderboard/main/leaderboard.py \nAnnual 2020 Winners:\r\n1) @Data Professor - Graciously handed first prize to the second place winner\r\n2) Ray Ojel - Winner of the HP Omen Gaming Bundle + 1 NVIDIA DLI Credit \r\n3) Jaemin Lee - 1 month subscription to Interview Query + 1 NVIDIA DLI Credit \r\n4) Tushar Sharma - Free access to my course + 1 NVIDIA DLI Credit \r\n5) Boris Giba - NVIDIA DLI Credit \r\n6) Mario - NVIDIA DLI Credit \r\n\r\nMonthly (December 2020) \rWinners\n1) Shruti Jain - Free access to my course + 1 NVIDIA DLI Credit \r\n2) Alex Bianchi - Define Wisdom - 1 NVIDIA DLI Credit\r\n3) @Data Professor - 1 NVIDIA DLI Credit \r\n4) Nash Mundondo - 1 NVIDIA DLI Credit \r\n5) Jon O - 1 NVIDIA DLI Credit\n\nLinks to all the resources I used in the description!\nTry watching these next:\nYouTube Algorithm Explained (By a Data Scientist): https://www.youtube.com/watch?v=YbTMIxjk4hI&ab_channel=KenJee\nFind A Data Science Project With These 3 Techniques: https://www.youtube.com/watch?v=yUrrf3Pm33s&ab_channel=KenJee\nData Science Project from Scratch Series: https://www.youtube.com/playlist?list=PL2zq7klxX5ASFejJj80ob9ZAnBHdz5O1t', 'hey ken! is this still ongoing?', ""I didn't see a playlist for this effort... I think you can build one that includes videos from all channels of concern... It will help us watch these in the best order...."", 'Streamlit say ""Oh no""', 'lol is the mask overlay a joke? i hope it is', 'Just commenting to get points. Like me, pls.🤣🤣', 'Hi Ken, can you tell me what is the small white white marker board made of that you use to sketch ideas? (E.g. at 11:10) Or how do you call it? I would like to get something like this to write out my thoughts, plans, todos.', 'New to this channel and this is really interesting. Looking forward to more content from u! 😄', ""This kind of videos is extremely helpful for beginners. Although I'm still very early in this DS journey (I've just started learning math and statistics), it helps me understand what I need to be able to do in the future. Thanks, Ken."", ""I'mma get the first prize one day💪🏼""]"
ji7DtgUeKCI,"[""Thanks for watching everyone! Check out Tina's channel here: https://www.youtube.com/channel/UC2UXDak6o7rBm23k3Vv5dww\nWatch these videos next! \nHow I chose my Masters Degree: https://www.youtube.com/watch?v=domVw8isGOI&ab_channel=KenJee\r\nHow  @Tina Huang  Chose Hers: https://www.youtube.com/watch?v=C8iL4V-y1Qs&ab_channel=TinaHuang"", '1. What you will be learning?  i.e. Curriculum\n2. Job Placement Opportunities? Check the stats and connect with alumni\n3. Class diversity and flexibility i.e. look for institutions offering courses you want\n4. Place of education i.e. online or offline (based on personal preference)\n5. Duration  - full-time or part time \n6. Research and Internship i.e. need real world experience (co-op etc.)\n7. Monetary considerations - may not get job after masters. \n8. International Students - STEM and OPT considerations', 'I got accepted into UC San Diego MS Data Science and although I wanted to get into an MSCS. UC San Diego was the most prestigious school I got into and I think that will at least land me interviews', 'Currently I’m majoring in CS and am debating getting a minor in statistics or management information systems. My school also offers a data Analytics degree from the business school that I’ve thought about switching to, but I’m unsure what the best route would be for getting a job as a data scientist. I’m assuming more technical skills from CS would be better. Any thoughts?', ""3:07so glad once again to live in Germany where University isn't free, but compared to the US it is (~1800$ for a Bachelors- and ~1200$ for a Masters degree)"", 'Is a thesis requirement generally a good sign of the rigor of the program? If the topic is applicable to the job you are applying for, I would believe this would be a good thing.', 'Thanks for adding Tina', 'FOCUS ON SKILLS.', 'THANKS FOR YOUR ADVICE', 'Can I do a master in data science without a relevant bachelor degree?']"
4039x4r-hGE,"[""Thanks for watching everyone! I hope you will join the #66DaysOfData in the future! \nLinks I mentioned:\nMedium Writeup: https://towardsdatascience.com/why-im-starting-data-science-over-21bec8036ce9\r\nOriginal Video: https://www.youtube.com/watch?v=uXLnbdHMf8w&ab_channel=KenJee\nDiscord Server: https://discord.gg/4p37sy5muZ\r\nGithub: https://github.com/66daysofdata/Resources\r\nThinam's Journey: https://github.com/ThinamXx/66Days__NaturalLanguageProcessing/blob/master/README.md\r\n66Days Website: https://www.66daysofdata.com/\r\nNotion Template (Via Ashley): https://www.notion.so/66DaysOfData-86145f47abde44e6ac30dbf484f3734c"", 'Thanks for starting a great initiative, even after many months its trending in Data Science community. Many people even started similar initiative like 100daysofSQL etc. Its awesome to see how a simple idea can grow this big and influence so many people. Thanks.', 'Thanks for the great initiative Ken...', 'discord link is not working', 'Hey Ken,\n\nThank you so much for all the work you put in your videos. \nBack in May, I started my data science journey after 5 years in project management and I was kind of lost on what path to choose. Following your advice, I started online courses, then worked on Kaggle projects, and finally built a portfolio. \n\nNow, 7 months later, I landed my first internship as a data scientist ! What tipped the scales in my favor was the portfolio, which I made thanks to the Hugo tutorial on your channel !\n\nSo here, thanks from a grateful subscriber =)', 'Thank you for this video and resources! I have already knowledge in data science and I found usefull ml engineering lessons', 'Hey Ken, I am finishing a boot camp where by the end of next week I’ll have spent 630 hours over 9 weeks, that’s 10 hours a day, studying Python and data analytics. I will definitely join you in January to keep up the momentum I have gained. I enjoying listening to you in my down time.', '* does data science for a couple of months\n*Winds up with a cool project idea\n\nDid your comment leaderboard idea come from these 66 days?', ""Ken, due to lockdown I really wasted a huge amount of time which whereas I was planning to be so productive and to master on DL. However, on that gap, I lost the knowledge I had :)) and added more to my depression and imposter syndrome. Now walking through your youtube videos (you have done quite great stuff when I was not out there ) makes me feel safe that I'm actually not that late and I can start it over, I believe that community is going to have a great impact on me! Thank you, I'm saying this deeply :)"", 'test comment']"
78LjdAAw0wA,"['Feel free to pose questions in the comment section here as well! Will do my best to get to them all!', 'I missed it smh. If you start making more as a youtube than a data scienctist and it start taking more time, what are you going to decide to do youtube full time or half yt half ds?', 'would you recommend the new macbooks for data science? Im looking for a new laptop which a long battery life and lightweight, any recommendation here?', ""Hi Ken, while watching this video, I just realized that I'm now part of one data science community. Wow, thank you for bringing us all together! I'm looking forward to more of your videos about Kaggle projects. \r\n\r\nLately, I found one very useful extension of jupyter notebook, TOC2, which automatically creates a table of contents with hyperlinks based on the headings. Its link: https://jupyter-contrib-nbextensions.readthedocs.io/en/latest/nbextensions/toc2/README.html. Once you try it, I bet you will love it.\r\n\r\nHowever, it's not available in Kaggle yet. The closest thing it has is to display the first level headings on the right in the reading mode. There's large room for improvement.\r\n\r\nLouis posted in product feedback on Kaggle six months ago (https://www.kaggle.com/product-feedback/153519), but received little attention. What a pity! Can you help draw more attention and upvote it? If you have any other ideas, please let me know. I strongly believe that getting our sharing notebook well organized and more readable is very helpful for the community. TOC2 will make it much easier."", 'Oh Dang Congrats, I remember when you had less than 25K. Keep it up, brother!', 'Very helpful session. Looking forward to more of these. Thanks.\nP.S. The questions were visible well enough  @ 720p. And it was good that you made them visible.', 'This comment stood out to me the most: ""Maybe it\'s more about the critical mass of what you create than the growth of the videos"" (39:46). To me, it speaks to cultivating internal motivations, having an internal locus of control and understanding that above all else, you must do the work.\n\n(And thanks for your answer to my questions, Ken. I can certainly appreciate the wisdom in planning in broad strokes and letting life fill in the details.)', 'Loved the session really helpful and learned a lot 💯❤️', 'Many thanks Ken for your live program which i watched later. Time zones btw the US and Oz make it difficult to watch live.  You are doing an amazing job, paving the way for future data scientists. Great mentoring. Congratulations on your achievements', 'OH NO I MISSED IT!!!']"
yUrrf3Pm33s,"[""Thanks for watching everyone! I'm having a lot of fun with the intros, I hope you all like them :). If you don't, I added chapters at the bottom so you can skip it easily! \n\nWatch these next:\n5 essential data science projects: https://www.youtube.com/watch?v=BBDiadC8BvE&ab_channel=KenJee\r\nTitanic Tutorial: https://www.youtube.com/watch?v=I3FBJdiExcg&ab_channel=KenJee\r\n#66DaysOfData: https://www.youtube.com/watch?v=uXLnbdHMf8w&ab_channel=KenJee\r\nData Science Project from Scratch: https://www.youtube.com/playlist?list=PL2zq7klxX5ASFejJj80ob9ZAnBHdz5O1t"", 'Gave you a like for the valorant name drop', 'Great tips ken but I have a really dumb question xD. Suppose I have a great project idea (lets say agriculture related), but now from where will I get the dataset?', 'Why do YouTubers not edit out the part of the shot where they are reaching for the camera off-button?  Is it a meme?', '7:48 Are you trying to say that building models is not necessary? Could you explain your argument here?', 'Great advice, thanks!', 'These 3 techniques will really make an impact on me to go ahead. Problem identification is a very much important skill in data science.', 'heyy nice video! i have a question, what technique do you use to scrapp data from the comment section of your videos???  i love your channel by the way', 'How afraid should we be about choosing projects that end up failing?  Sometimes I get caught in this idea that I need to find the perfect projects that I know would be successful before I even start exploring the data.', '02:40 What were your 10 ideas to improve airline flights?  Just curious.']"
