video_id,comments
foggudmDDvY,"[""as a newcomer to golf during the pandemic I'm absolutely hooked by the sport and find your content a gem :) hopefully more and more golf equipment manufacturers will incorporate ML/AI into the process of making the clubs which also present itself as a great marketing opportunity such as what Callaway is already doing. I'm hopeful that the future of the golf simulation market relys on visual based ML/AI and will drive the costs down for the barrier of entry so that more ppl can enjoy golfing at home!"", ""#66: Last video of this round, and was about Golf. I think is a coincidence 🤓\nKen, thank you for the #66daysofdata challenge, really helped me to evaluate & organize my time, I feel a little bit more confident of my knowledge in DS, now I have more ideas on how to move forward in my projects, I'm grateful for the opportunity to have access to new courses (Udemy & NVIDIA).\nI will keep moving forward, and because this initiative has helped that much I will start Round 3 right away, videos will be on this one too but I will be more focused on projects, I will share them for sure!! \nT\nH\nA\nN\nK\n\nY\nO\nU\n#66daysofdata"", 'The simulation is really cool. It was one year ago so there are more advance and cooler versions of the golf simulator.', 'Another awesome video, Ken!  Golf has been a big part of my life and now I’m in a data science bootcamp so this video was very interesting. Thanks for the perspective!', 'you should start a data science discord server', 'This is very interesting Ken!']"
n3vw0M5RrPU,"[""Hey Everyone - Thanks for watching the video! If you have any questions, please leave them below. I also can't stress enough how important projects are for learning data science. I highly recommend watching the other videos that I have pinned at the end of this one to learn more about them!\nSome learning Resources:\nMy Favorite Free Resources for Learning Data Science: https://www.youtube.com/watch?v=Ip50cXvpWY4&ab_channel=KenJee\n365 Data Science - Courses ( 57% Annual Discount): https://365datascience.pxf.io/P0jbBY"", 'The one video of yours that a few are watching and everyone should watch.', 'Thanks my data science professor for teaching me so much always every single day😁', 'Play video at 1.25x, thank me later', 'Did he say he got 2 master degrees? what was the first one? the second one was comp sci...', ""#65: The dog ... okeyyyy 🐶\nSo statistics, yeap think mathematically is important on DS. \nI get stuck sometimes thinking which is the best way to play with the features. Really STUCK! (Any advice on this?)\nIt's nice to hear your story, and how the experience vs. interest give you a nice path to DS and ML, and how you share what you learn in this videos. Thank you! :)\n#66daysofdata"", 'Hi Ken', 'Hii Sir,\nI am from Electrical Engineering background and I want to opt  """"Data Computational Science"""" for my masters (M-tec). Will it be a good transition ?', 'Always watching this charming man without speeding up. Totally intrigued.', 'Thank you for your video! Very encouraging to start learning ! What do you think about Coursera courses? I am taking python for AI from IBM now to build my python skills']"
2OnXytYziF0,"['I think I want to do something in either the moneyball field (helping teams) or DFS (predicting outcomes), but I’m not sure which one. If I learn some data science and sports analytics skills, will they be useful in either field?', ""Hey Ken! Great video. I've done some simple sports analysis in my own project portfolio. How can I start to find the jobs under type 1, type 2, or type 4? I couldn't find the company z-grew that you mentioned based out of chicago."", 'do you suggest applying for internship for sport analytics or just self-learning by projects ? for an undergrad.', 'GREAT VIDEO BRO', 'Thanx for the videos bro \nReally insightful 😄', 'As a sophmore in college im majoring in stats and want to pursue the moneyball side of business. what would u recomend for a minor?', 'Hey Ken, great video! How hard is it to break into sports analytics compared to other fields? And would getting a job in sports analytics close doors to working as data scientist in other industries?', 'Hi ken, just subscribed your channel.😊\nJust want to ask several questions.\n1) what should i learn first to join sport analytics industry? Sql? Python?\n2) i am interested in Volleyball. Does volleyball familiar with sport analyst? (i dont know if this question is right😅)\n3) does sport analyst earn a lot?\n\nThank you Ken💐', 'ok so i’ve been wanting to get into baseball analytics because I have a friend who is in the field and it is very intriguing. i’m only a junior in high school right now. how should I get started?', 'Is it difficult to find a job after completing a masters in sports analytics?']"
Q9FjwzKFPuM,"['Thanks for watching everyone! Although not explicitly mentioned in the title, I highly recommend exploring the self taught route. There are plenty of great online resources out there for you to use.\n(Free) My Recommendations: https://www.youtube.com/watch?v=Ip50cXvpWY4&ab_channel=KenJee\n(Paid) 365 Data Science - Courses ( 57% Annual Discount): https://365datascience.pxf.io/P0jbBY', ""Can you give me a data science bootcamp remmendation? Currently I'm looking at local bootcamps but I want to join one with international recognitions. Any suggestions?"", 'So certifications are not really helpful, what are the odds of landing a good job if i do few good projects to add to my resume? Are they promising?', 'where can i search bootcamp programs ?', ""Hi Ken! Thank you for the content, I'm letteraly watching every video one by one for a week now 😂. \n\nI'm thanking about starting at data science in a year or so and I think a data science certificate (looking at IBMs) is a good option since I don't have any background at all. Is it a good option to go through this certificate as a part time activity for maybe a year and then trying a job field transition later?\n\nThank you again. Best"", 'Thank you. Very helpful advice', 'Thanks for the video! I’m looking to get into Data science after my bachelors degree in sports management not helping me( Thanks pandemic). So I’m currently trying to work on some personal projects!', 'brooo you look just like the dude from lost. the scientist', 'I work in the government sector, ministry of finance of my country and i like doing forecasts on cash incomes and expenses. I want to set myself apart from my colleagues who all pursue MPA. Would it be a good choice to pursue a Data Science Masters? I got a Bachelor in Econ. by the way with major in macro econ but i would like the flexibility to also work freely in the private sector.', ""I am 44 and have a bachelor's in accounting info systems from the year 2000...and I about to finish the google analytics data certificate knowing full well that I probably won't get a job with it...I want to just look into it...then I was thinking to get my masters from Eastern University...or maybe a more inexpensive bootcamp...but the price is holding me back...because if I self study I will probably just finish like several language certifications...I work full time as a manager at Apple Tech Support...I want to get off the phones...I am also self studying through ed x...and several other courses...literally I study a few hours per day every day...I figure over time...""]"
VN12ZPFsApM,"['Thanks for watching everyone! If you\'re looking for specific resources to learn from, there are plenty of great free and paid ones. \nSome free ones I like:\nhttps://www.freecodecamp.org/\nhttps://www.learnpython.org/\nPaid one I like:\n365 Data Science - Courses ( 57% Annual Discount): https://365datascience.pxf.io/P0jbBY \n- Course taught by YouTuber ""Python Programmer"" is really solid. Also have access to the other data science courses!', ""I'm curious, what are the new programs used, seeing that this video was made 2 years ago.....which languages are in trend"", 'Do i need to learn Computer algorithms like searching sorting algorithms', 'Lol. I like how you talked about the programs people used for stats. We old farts used a pencil', 'Yes, it is such a big downer to know statistics but to don´t be able to do a fing simple thing because absolutely nothing works and you can take 3 hours surfing from one topic to another on stackoverflow because you can´t even ch ange the color of a table. I miss Spss so much', ""Hi Ken, I'm currently doing a structural biology PhD. The only experience with python/programming I have is through two things: 1) undergrad research where I was doing in silico drug screening against to protein homologs via programs such autodock followed by molecular dynamics. I had to write a few basic python scripts that made the program I was using (YASARA) run and export these simulations over about 20K small molecules per homolog. Things YASARA didn't have built in. That was 4+ years ago (took a job as a technician in a structural biology lab for about 3 years). Finally got into a PhD program but want to move into the computational side (though not entirely giving up wet-lab/experimental structure determination. I'm currently doing my lab rotations and have become more interested in methods. So for cryo-EM and crystallography using computers to help aid in determining structure, which requires ML/DL. On top of that I'm still interested in molecular dynamics of protein-ligan interactions, etc. Which might not be as influenced by data science. Lastly, I had a short course (about half a semester) that introduced R for bio/strucbio data analysis and plotting.\n\nI've been reading a lot of theory (as that's what most professors I'm interested in working with/rotating through seem publish) but still have and am working on my python programming.\n\nAny suggestions for this path? How does one balance graduate school with learning a new skill? The PhD route takes up so much time, how does one learn programming to slightly change projectory within their first year of grad school (to be of interest to comp bio/phys PIs but also so that one has enough experience so that they're not embarrassed or feel like they're holding the research back)?\n\nThat was long winded, but thanks!"", '1.5 speed is your friend', 'Awesome content.  I just signed up for Kaggle yesterday I think (days are running together.  I work from home) and I 100% will be sure to try this approach.', 'I have learned variables, loops, all the way to functions and objects. What do you think should I learn next?', 'LLLLove your videos so much,  not only the content but also the way you talk. It’s vastly helpful for me as a non-native speaker.']"
WKXtTo7lqmA,"[""Hey everyone - Thanks for watching! Sorry if the volume is a little distorted, I thought I fixed the problem, but it looks like I haven't. Will get it figured out by the next fundamentals video!"", 'Hi Ken, registered for your conference on 18th and 19th May.', ""Hey, Ken. I have installed SQL Server Installer for Developer Edition and Microsoft SQL Server Management Studio - 18.8\n\nBut while Restoring the database I am getting the following error. You said that you will link the video for how to install.. Can you help me with this error?\n\n\nTITLE: Microsoft SQL Server Management Studio\r\n------------------------------\r\n\r\nAn exception occurred while executing a Transact-SQL statement or batch. (Microsoft.SqlServer.ConnectionInfo)\r\n\r\n------------------------------\r\nADDITIONAL INFORMATION:\r\n\r\nThe media family on device 'C:\\Program Files\\Microsoft SQL Server\\LahmansBaseballDB_2018.bak' is incorrectly formed. SQL Server cannot process this media family.\r\nRESTORE HEADERONLY is terminating abnormally. (Microsoft SQL Server, Error: 3241)"", '#61: And again, the sound of a siren he he\nGreat tutorial, basic and understandable. \nI have done a lot of SQL in my life, a LOT! Short story, a tool was badly developed in one of my past jobs, so I had to do an App SQL version for the users to fix all the unfortunate trash that the application was doing to the data, what a mess!!\n#66daysofdata', 'Thanks again Ken !', 'Thank you so much, I was looking for a way to host a local server for crunching some baseball stats and you nailed the setup.\n\nI ended up following you down your queries for fun and noticed that when I went to save my view, I got this error.\n\n""Column names in each view or function must be unique. Column name \'playerID\' in view or function \'WinningPitchers\' is specified more than once.\r""\n\nI found that curious since that\'s just from when we quoted out our join.', 'Is this microsoft sql server the same as mysql?', 'Please make more of these', 'SSMS can not be implemented on MAC OS, is there any other tools that I could use on the MAC OS? THANKS', 'Hey Ken. ¿What can I use in a Mac since SQL Server is not available for Macs?']"
9-2OKLZfvbE,"['Definitely coming back to this video.  This is a fantastic set of questions', 'i think u are the only one on ut that talks about it\nits a very good video, thanks!', 'this is important af!', ""#60: Very interesting this one, I know you are focus on DS but this could be an overall reminder of what to ask when you are finding a job, the one I like the most was about the development opportunities are there within the company? \nWe must grow, remain the same doesn't help to our environment.\n#66daysofdata"", ""The last question could be understood as if you were fishing for feedback, hence might indicate lack of confidence or even a lack of understanding to the position you are interviewing for. After all, you have supposedly done your homework and established a strong link between your knowledge, set of skills and the open position, the company's vision, goals, etc. In other words, how would you add value to the company if you still do not understand how your skills and expertise align with their expectations? As an interviewer, I'd view that question in a negative light. But there are ways around it and you can still get that sort of feedback indirectly. Apart from that, great video and great tips from you as always. Keep it up."", ""Thanks! I've learned a lot from your channel~😛 Could you post something about the case study in DS interview(some non-technical part)? I feel like it's also important for data scientists 🤔"", 'Great!!']"
3TrAYmrmA8o,"[""That's a very big list to read. Started the readspeeder course today , Will practice it everyday."", ""#59: Seriously 52 BOOKS!! What the !!!!📚\nThat's crazy, you are my hero!\nAs always is really nice to hear your reviews, I must confess I'm not good at reading, so Audible is becoming my best friend, I'm now hearing Designing your life, and is a book that is changing my life. \nAlso on paper, I'm on Mathletics, I'm taking notes, I hope to read at least the nine that you recommended! \n#66daysofdata"", 'You probably have the reading process down, but check out Speechify. https://m.youtube.com/watch?v=Hx8H9-jmYPw', ""Can't Hurt Me and Deep Work are great books. Just a little suggestion, it would be much easier to create and share your profile on Goodreads.com :)"", 'Hi, I\'ve heard also some negative information about this book ""Why we sleep"". I haven\'t read it yet by myself (but I want to do it soon), but in the other yt video I\'ve heard that author\'s research are quite questionable, like lower cancer rate when you sleep less than 8h (something like this). I think this makes sense, because just like diet, everybody\'s need of sleep is different and it should be more personalized aswell. Nobody should force himself to sleep more if his body doesn\'t need it. Your channel is great anyway, keep up with the solid work!', 'Super helpful video/links! Thank you so much for sharing. I finished ""The One Thing"" last week and was super happy with it! Definitely my preferred type of book! I just wanted to know where you found these books? Were they recommendations from colleagues or possibly a list of books found on a website? Also, if you had any recommendations on books to learn more about statistics, I would love to hear about them! I took statistics in undergrad (which was a few years ago) and am in the middle of a career change and would like to brush up on the theories and the essentials for data analytics/data science!', 'Thank you for those valuable recommendations,\nI\'ve just placed an order for the ""one thing"" :)\nSide note: the Weitzman institute is in Rehovot, Israel. not in Europe', ""That's a lot of books! I love reading and this is right up my alley. Thanks for the recommendations!"", 'Thank you so much for sharing these books! I really appreciated how you share information with people!', 'Another great video! Out of curiosity, how did you make the time to read one book per week?']"
5SjK6YCs4o4,"['So detailed wow! Thank you!', 'Me hitting a like before even watching the whole video 😌😌', 'What are some of the companies you have found that have a good data culture?', 'Damn ken, almost a year and a half from this video, you have improved a lot, but always maintaining the quality of content', 'Guys what do you wear or what can you wear or what is acceptable to wear in a data science interview ?', '#58: Sound scary, more for an Introverted person 😅\nThank you for the tips and the links related!! A lot of work to do to be ready 👩🏻\u200d💻\n#66daysofdata', ""This is like... for people who already have quite some experience right? Like it's gotta be different if you're going for an entry or junior position, right?"", 'How long typically the inperson interviews?', ""Ken, thank you for such an informative video! When you mentioned live coding interview tests, does that only include leetcode questions or could we also expect kaggle-like questions? \n\nFrom my experience, kaggle-like questions are usually take-home assignments, but I've not heard yet whether companies ask us to live code on Google doc using Pandas or something alike."", 'Hey Ken, great video! I was wondering if you ever had any onsite modeling interviews. I have one coming up in 2 weeks and the time limit is 2 hrs. Would it be similar to a takehome assignment?  Thanks in advance!']"
iqG59TqfFdY,"[""#57: Hey Ken, how that year went for you? Did you wrote understandable code, attended + DS events (This I think was tricky, the things we can't control), updated your README ➡️ Github, participated in Kaggle competitions, and made projects accessible (✅ I think you kill it in this one, 2020 was the year where I knew you and has been a great journey!)\nI just making you accountable he he 😅\n#66daysofdata"", 'Great resolutions! Some of my comments:\n1) Nice thought, but optimise for what makes sense to YOU, not to some arbitrary set of criteria of what qualifies a ""good code"" by engineers. But obviously if you can\'t efficiently read/reason about your own code - then improvements are due! Functions/Objets aren\'t ALWAYS the right way forward, and there are also pros and cons to speed of development VS meeting ""classic"" code standards. Machine Learning is NOT the same as traditional programming, and same measures of quality should not be blindly applied to both.\n2) Good thought - but just keep in mind that something that can take a whole evening if you go to an event - can be ""consumed"" at 2x speed on youtube in 40 mins. Events are important for networking and benchmarking yourself against other professionals, but don\'t have high expectations of actually LEARNING from talks - it\'s rather inefficient.\n3) Github is definitely a place to be. Good README are always appreciated. Please share everything you can - you never know who could benefit from it!\n4) Kaggle is amazing platform - it could be very hard to get into their way of thinking (it\'s like a parallel universe at first), but there is also so much to learn there. Just keep in mind that any particular technology that is state of the art today - might be completely obsolete in a few years time. Approaches to the problem and ways of thinking don\'t change as often.\n5) Best resolution possible! When you do your work truly end-to-end you really learn so much more. I would focus on K8S (that you mentioned earlier) - I think it is the future, and spending time learning AWS or Azure specific ML tools might not be the best investment of your time.\n\n\nMy resolutions:\n1) Own my work more end-to-end (same as your 5). Have a say both in how data is collected and presented to the DS team, as well as a say in how the final product looks and feels.  NOT being just a ""cog"" in a chain, but truly understand meaning and impact of my work.\n2) Get to a level of Master on Kaggle (same as your 4) if possible, or at least do a few public kernels.\n3) Attempt to build side projects which other people who aren\'t data scientists can interact with (like that pix2pix live demo)\n4) Get more certifications and accreditations related to IT and ML\n5) Finally get into PyTorch properly and become an expert\n6) Improve my ability to read/analyse scientific papers. (So I don\'t have to wait until some YouTuber reviews them to get an idea about what\'s going on in our field)\n7) Get a grip on Probabilistic Programming - I\'ve been struggling with it for quite some time, and I think I\'ll be able to make it useful soon!\n\n\nThank you for an interesting and relatable video!', 'My resolution is to be as ready as I can be for when I start my masters in data science program at Denver next fall.  I will be using a lot of Codecademy, Dataquest, Udemy, and Kahn Academy. I would also like to have a handful of smaller projects uploaded to GitHub before the end of next summer.', 'I’m new to data science and would like to know what you think the best programming languages are in the current state of the field.', 'As an analyst my resolution is to scrutinize each element of my reports and dashboards more.  I tend to focus more on the big picture and forget to focus on how each element could be improved.  As someone who is trying to learn data science my resolution is to give myself a project that seems achievable and finish it by the end of the year.  Documenting is one I think almost all of us can work on.', 'I can\'t imagine explaining data science, I have enough trouble as it is explaining my job as a data analyst.  It has gotten to the point where I explain data as paint, a blank excel or power bi file as a canvas, and my job is to paint a picture that speaks to my audience.  Still think only half of my friends really understand.  Most just say ""oh so you know how to do pivot tables"" and move on.']"
NCyPY-jfb3I,"['bro, thanks', 'To the point and practical. Appreciate it', 'great content - I am looking for other similar APIs for other major sports - NFL, MLB, NHL.  does anyone have suggestions', 'Thanks for this, mate!', 'Can we use this api with R?', 'Hey Ken awesome stuff, really enjoying this API! New to Python so apologies if this is a bad question. Trying to use the ""SeasonAll.all"" feature you used, but it is not working for me. I assume that is because you defined or created that earlier. Any suggestions on how to do that?', 'this video is fantastic - thanks Ken!', 'what are you pressing after you select the code to see what it spits out?', 'Thank you Ken, this content is amazing!\nI get a timeout error when trying to get data from GameLog in a Google Colab, does anyone have the same problem?', 'This is my first hands-on on spyder. It is a really nice tool.  I just tried the commands through the video only but it was interesting. I tried to understand the terms mentioned in it. I will try to explore more about it and will try different variations. Thanks, Ken for the video.']"
DopikusDfk0,"['4:57', ""Excellent video, it is worth noting this is based on spreads/totals with standard hold priced at -110 or 1.91. I am starting a trading analyst role in the sports book industry soon myself, and think your channel will really help advance my skills and thinking all around, so just wanted to say really appreciate what you're doing!"", 'In Glad i found you here', 'Particularly interesting considering I recently got an offer for a sports betting hedge fund. Thanks for the videos, they’re really detailed and been overall so useful', 'Thank you for the details. Also, Would you like to share your opinion on Social media + Data science?', ""#55: Love your honesty about getting into this field, sports are more than betting but what we can do, it's also a business. \nI do like the analysis & the insights of the data in sports, and from that perspective, your videos have been really helpful! AS always, thank you!\n#66daysofdata"", 'Your videos are great bro', 'Had to hit that sub. Thanks for being the one stop shop for data science and sports analytics on YouTube. Keep it up 👍🏾', 'Can you elaborate a bit more about this venture funded ML predictor? Around 4:30', ""Great video Ken and I really enjoy your channel ! At around 4:57 mark you said you probably wouldn't  recommend betting on sports in the first place. Would you mind elaborating on that and  explain why you wouldn't? Keep making these good, informative videos! Thanks!""]"
