video_id,comments
oNvyvYGw5n4,"['I am distracted by the 🐶 😍', 'Thu Vu is my latest favourite :) Big props to the OGs Forrest Knight & Keith btw!', 'The most handsome data scientist / software engg  is hiding in corner ""Forrest Knight"" 😉', 'Awsome  !!! nice to see great personalities of Data Science. under one roof. ( Missing  .. Aishwayra, Sundas and  Thu Vu ).', '📍📍 Сведочанство ће ускоро почети да се развија када будем финансијски надоградио након што сам веровао свом водичу чак и са овом несрећом која је у току', 'Poggers!', 'So excited to see Keith there ☺️☺️.\nIt a full house this Time around.', 'Crazy day, I just get to see this! I love this GANG!', 'Nice!!!!,  aleast Keith is in the House', 'There is no krish naik']"
GaZRuchRCyw,"['in a world of vscode is nice to see people liking jetbrains products', 'All legends in one place', 'This is so cool 😎  wish the web developers youtube community were like this instead of being crabs 🦀  in a bucket \U0001faa3.', 'This is awesome, you guys are building generations to come. \nImpacting knowledge 🖤🖤.', 'So cool seeing you guys alll together. Big fan from The Netherlands 🇳🇱. Keep it up guys love the content 🤞🏼❤️', 'Loved it! And great inspiration as always too,  Keep up the good work!', 'It would be nice to have people from the business intelligence field too. Enjoyed the video.', ""oof I missed this :(, but who's stopping me to replay this lol"", 'Thanks to each and everyone of you. I began my data journey roughly a year and a half ago and each one of you at some point has helped me in that journey. I will never forget when I emailed Alex the analyst regarding a dilemma I had in choosing a masters program he replied and helped me narrow down my decision.', ""Hi Ken, very insightful discussion from everyone.\n\nThanks for putting this together.\n\nAvery is a cool dude but why is he spending more time on his phone.\n\nplease, can you add the links to everyone's socials.""]"
EBjYqC3aNTA,"['To get things started, I would like to do a python project where I automate the watering of my plants! Share the projects you would like to work on below!  Again, thanks for watching! Be sure to check out all the resources in the description above!', 'I can attempt to take you on in a cook-off but not in Jiu Jitsu 🌻\nGreat video Ken ! Thank you', 'I switched to Mac and I never look back !', 'Thanks so much for this video. The link to the youtube for freecodecamp isn\'t working. I had a question (perhaps for another video)— what ""certifications"" (if any) are valuable in the DS space?', 'This video is amazing. Thanks for sharing your wisdom. \nWhat I would love to make with python is an automated speed test for my internet that collect band width data every certain amount of time to make a dataset to present a claim to my internet provaider.', ""I train jiu jitsu as well. Blue belt here! Learning Data Science as I found a passion in working with data. If you're ever in Michigan please let me know and come train with us at our gym! I would like to eventually find ways to use data science to come up with interesting projects within the jiu jitsu landscape."", 'I was about to make a similar video and watching this inspired me plenty of new ideas, now I have to rewrite my entire script so thanks for nothing. Jokes aside, great video and inspiring as always!', 'I started doing some EDA on data from my workouts acquired from my Apple Watch, but I’m unsure where to go from here. Anyone have any suggestions? Thanks in advance!', 'A video many have been waiting for!\n\nA Ken Jee classic! I agree that at first, coding ""seems"" hard and challenging.\n\nOnce you get started with your first project, you begin to realize how much fun it is! A few well documented personal projects later, you\'re well on your way to potentially apply for entry level jobs.\n\nKeep grinding everyone!', ""This is awesome! I'm in my first semester of master's program in Data Science, but I was having a hard time since I come from linguistics background. Now I feel like some clouds have been cleared up. Thank you so much for the video and can't wait to watch your next content! Cheers :)""]"
QMP858aZcow,"['Thanks for watching everyone! Sorry for the bit of audio echo, getting used to the acoustics of the new office! Learn more about the Z by HP Data Science Stack Manager Here: https://zdocs.datascience.hp.com/', 'So last week I found out I had notifications disabled when someone mentioned me on LinkedIn! Then the the other day I found out my Twitter DMs are locked? And literally just as I’m about to tuck in for the night I found out there’s a bunch of vid mentions I missed…including this one 🤦\u200d♂️ Ahhh my bad, hope you’re doing AMAZING Ken!!! Love ya work!!!', 'I just found you, I have seen a couple videos of yours and I am amazed with your content. Thanks for sharing!', 'Hey ken jee \nSome with an accounting degree wishing to transition to data science can I do a postgraduate diploma in Cs will it count as a masters ?', ""Great content as always! I hope to help more people one day by having a wider reach like you, so your content motivates me a lot. Can't wait for your future content!"", 'Hey ken Jee \nInstead of masters in data science can I use an alternative and do a micro masters ??', 'I got DALL-E access this morning!', ""Do people go through a phase while learning Data Science that no i can't do it at all? :( Going through the phase when i have started working on my projects.:("", 'Who could have articulated it any better ? It is clear and transparent glass now,in my mind.Thank you #respect', 'The opener killed me']"
0ItYIoOrrUs,"['Special thanks to SAS for having me out at the batting lab! Do you think I have what it takes to start my baseball career up again?', 'One of your best videos yet!  Data literacy is soo valuable and important.', 'What the heck this was so unexpected but awesome!  Felt like I was watching a professional documentary.  I wonder if data science could ever help me learn how to not look like a dork when I dance lol?  Probably not 😂', 'Thanks Ken for another great vid , I began data science after school as a way to break into the tech ecosystem, I am also a huge sports fan and founding out that data science can be used in sport as sport analytics has been a great delight. .. please what advice can you give a beginner in data science that wishes to go on the sports analytics path ???', 'Wow, haha, I had no idea that you were in the Cary area so recently! The RTP area is a pretty cool place. I love it here. Outside of getting a cool tour and experience at SAS, I hope you got to do and see some other fun stuff here! Great video as always. I really liked how this one was edited and shot.', 'The Lab looks like a fun project with an important cause. Great video!', 'hey Ken very cool video! Applied machine learning is severely lacking on YouTube and videos like this will hopefully promote that change!\n\n i just posted a video going over a free online analytics tool i made, could you check it out and give me any feedback?', 'Can machine learning Improve  sports betting analytics', 'What a swing and training montage!', 'Really cool video, interesting to see such a good real world application of Data Science in practice, would love to see more such kind of videos!❣️🤩']"
KzTFoUbThvM,"[""Special thanks to Luke, Tina, and Miki! Check out Luke's video next! Check out Luke's Video Next: https://youtu.be/i8PKI_zJfDU"", ""The collab we didn't deserve but got anyway:"", 'LOL!', 'Very informative! You helped me find my passion with your videos and you inspired me to try to do the same for others by starting a Tech Youtube channel myself. So thank you for that!', ""Hi!\nHope you're doing well\nIs master's degree needed to land a job in data science or a bachelor's degree is enough?\nDo we necessarily need a master's degree??"", ""Hi,\nSo I had a question.\nSo basically I'm going to college this year. I'm enrolled to get an online BSc degree in Data science program from an IIT. I'm also going for an undergraduate degree in computer science. What else should I try to do in this hectic schedule to get hired as a data scientist when I graduate?"", ""The BEST comedy i've ever seen 😅😅😅🤣🤣🤣🤣 you guys, really creating this gang are awesome! Giving all this content by free... right now i am learning DATA CLEANING with Ken ! Luke always make me laugh... and Tina I LOVE TINA 😍😍🤩 Most clever girl i follow in YouTube"", 'we need more like this too 😂', ""legend has it that we still haven't nailed that dance yet"", '😂😂😂 this was great, I definitely ""evolved"" from the excel/power bi user to Ken. I current work with a ton of software engineers, docker jokes made me lol']"
bBJd0oPdNak,"['i love seeiing Mikoko out here!!!! Bo YAAA!!!', ""Love you guys..\nYou all motivate me.\nI'm starting out as  a data engineer"", 'What a great community!! \n\nI love all of you guys❤️', 'You need Alex Freberg to crash the party.', 'Great livestream and congrats Ken on 200 K!', 'Data science all stars!!', 'That clickbait with Tina😀', 'what a data squad !', 'Super cool, peeps!', 'This was such a fun livestream!! 🙌🏼 We gotta do this again ASAP!']"
Yk-unX4KnV4,"['Check out the #30DaysOfStreamlit here! https://share.streamlit.io/streamlit/30days. Again, this is a great learning objective that can be done alongside the #66DaysOfData!', 'Thank you so much for such a good project. Would love to go along with more projects from scratch.', ""Hi Ken, Thank you so much for this project. It's an eye-opener. I have a problem though, my publish date column is also implementing colors. I would appreciate it if you could help me understand that better, Thanks again"", 'Ken thank you so much for those videos! I was wondering if you could make a video about creating your own dataset/data scraping for portfolio project? Thanks:)', 'Hello, is it possible to use this project and show this data as a web interactive app that the user might interact with?', 'Hello Ken!\nU am bew to Data Science and I really love your channel & content. I have a major in Food Science and I want to make a huge change to my life going into Data Science. What online complete course do you recommend for me to get please?', 'woww this video is a wonderful video and pushed me to some other videos in your channel. great content. thanks for uploads. ,.,.,.,.', 'Wow, this is exactly what i looking for! Thx Ken Jee', 'Is it necessary to create a python environment first?', 'Thanks for this video sir. Please make more like this 🙏']"
z0_xrtFdFj8,"['Special thanks to Dice.com for sponsoring this video! Visit their awesome platform here: https://bit.ly/3Itt5go \n\nWhat job questions do you have? Ask away below!', 'Your videos have been such a driving force for my motivation, Ken! I’m a physical therapist hoping to use my doctorate in PT and medical domain knowledge to eventually leverage my way into a medical data science position. I find myself going to your channel at least once or twice a day and soaking up any insights you provide. Keep up the good work! Your content is valuable to many.', 'I just started applying to data science jobs this week. There are so many postings, but so few of them I actually want to apply to.', ""Hey Ken, great video as always thanks for sharing. I am trying to transition from a senior operations manager in tech to a Data Analyst, and I'm having some difficulty.  I know it doesn't sound like I should but it's definitely happening. Can you share your thoughts on how one should approach transitioning from various roles to Data Science?"", 'I love the way you explains the complex things in very simple way. No surprise that you are very good in networking. Your videos are very useful and I am looking forward to learn alot in future as well. Keep up the good work. 😊', 'I am still confused about how to approaching the job search as a data problem and using that to my advantage', 'Love this video!  I appreciate the insight.', 'Thank you Ken', ""Great insights shared with a lot of useful tips that can help maximize landing a data job. It made me realize a couple of things that I can improve, specially narrowing down my job searching opportunities, focus my portfolio to fields i'm interested in and improve my networking. Thanks a lot for sharing this content! Amazing stuff!"", 'Hi Ken I got called after 2 days for a position called business controller junior intern, and I rejected them as I have exams behind and as they were offering me a 8h full time which seemed impossible combined with studies or attending lessons. I thought that after this I could later transition to business analyst and data analyst. \nData engineering seems great but codes I found from free courses didn’t work out, compared to data analytics courses and data science courses.']"
vVpkXEIn-q0,"[""Start using Deepnote today: https://deepnote.com/home?utm_source=youtube&utm_medium=referral&utm_campaign=kenjee_nftvideo\nOur Code: https://deepnote.com/project/NFT-Analysis-YouTube-Video-eWcTN9tISeOZmHGwVNH8rw/%2FFinal_Analysis.ipynb\r\nOur Dashboard: https://share.streamlit.io/averydata/nft-streamlit/main/nft_dash.py\r\nAvery's Channel: https://www.youtube.com/c/AverySmithDataCareerJumpstart"", 'Urgh tbh the clickbait in the thumbnails and titles, and even video content now has gotten too much for me. Unsubscribed', 'Hey Ken, just got admitted to MS in Data Science and Analytics at Georgetown University. Is there any way (in another comment, email, etc.) in which I could get your quick opinion on what courses should I focus on taking so I can make my experience as valuable as possible ?', ""Sorry Ken! Haven't been able to stay active in the comment section lately because of the exams"", 'Soon we will have our own collection of DS peeps NFTs lol .. Great video Ken ! Useful for tax evasion ig lol', '""wen utility?"" Loved this video so much, and has me excited for doing some more data analysis in the space!', 'So cuuuuuuuuuute! I need to do an angry papaya project.', ""My advice to investors right now, Just seek professional help from a good financial adviser to avoid loosing money.  I'd suggest you get assisted by a market advisor like BLAINE PHILLIPS JR .  the forecasts and market views are best entertaining but completely useless.."", ""NFTs are pretty risky so some data analysis is certainly useful for anyone who wants to get into them. Frankly, after getting in on NFTs early, I'm totally out now. One other example of risk is how little regulation there is upfront. I flipped an NFT that a few days later was determined to be copywritten material and the entire project was deleted from OpenSea entirely. Anyone who still had one in their wallet got stuck holding the bag on that one.\n\nWould be interesting to do some analysis that allowed you to spot trends and get in on NFT projects before they really blew up. Still feels like gambling though lol."", ""I really appreciate the great you did Mr.Ken Jee it is really amazing. I'm so interest  with data from the perspective of the reearch .""]"
aipz4p7GDL4,"[""Thanks for watching everyone! Be sure to check out Luke's channel for high quality data analyst content and more awesome skits like this! https://www.youtube.com/c/LukeBarousse/featured"", 'So hilarious you have pictures of other data scientists on your desk))', ""There's a Tinaa and ken photo, In the luke's desk. I think they are somehow related, I'll keep researching on it."", ""So accurate!!!!!!,  we just switch from Kanban to scrum , and we too have been struggling with time constraints and we've turned everything to stories !"", 'Stick with the data science ... leave the humor to those who are actually funny.  Man that was cringy to watch ... smh!', 'Haha.  Well done, guys!', 'This is one of the best written videos I’ve seen in a long time.', 'The photo of Alex The Analyst at 1:55 cracked me up! 😂😂', 'Tina and Data professor pictures 😂😂😂', 'This was gold!! 😂\n\n#PapayaMasterKen']"
iPdO9MwdcLE,"['Thanks for watching everyone! I hope you have a better understanding of what it is like to be a professional data scientist! Sign up or learn more about SharpestMinds here: https://www.sharpestminds.com?r=ken-jee . Again, SharpestMinds is a data science mentorship marketplace that only gets paid when you land a job!', 'not all decisions are mad with logic. this hits really hard the long you work in any field :)', 'btw the link in the bio isnt including your ref=kenjee, might want to change that so you get a comission', 'im an etl developer who does machine learning. literally spend most of my time scrubbing/cleaning/transforming data. derp', ""I just came across your data science course on Skill up by simpililearn, I'll like to know, if I move on with this course, will it give me all the skills required as a data scientists? Or what are your recommendations"", ""Ahhhh i'm in high school and really interested in data science and plan on majoring in it.. i just am a bit chary on the math involved because I'm unsure on how much and why math is involved in the first place. It isn't my best subject but i hope that doesn't stop me from one day becoming a data scientist."", ""To help others out and save money I'd recommend do NOT go to college, get a few data related certificates. Start off as a entry level data analyst and while working utilize Udemy and YT on data science info. \n\nAfter approximately 3-5 years as a data analyst apply to a data science job. Boom! Just saved you money. Any further details needed, just let me know.\n\nAlso, Google is your best friend. Learn how to use it being in the data world."", 'Thank you for posting this video. This past year I migrated to a new work role and am listed by my employer as a data scientist.  This video confirmed my understanding and also cleared up confusion as many people, my employer, and consumers of our products have different views of a data science work role.', 'One of the best reveals I’ve seen about data science. My question now is if it’s better to be a product manager or project manager? Autonomy and authority are some of the most important job factors for me. Are the product and project managers literally managers to data scientists and software engineers?', '11:02 ""sometimes kevin doesnt want to use the stupid dashboard that you built and spent 7 weeks on because he doesn\'t like the color scheme and he wants to use pie charts all over the place""..... Had me DYING 💀 I had to pause it. I played this clip for my husband *not a data scientist* and he laughed because THAT is me while I\'m working from home.']"
YPph59-rTxA,"['I hope you all will join me on this project! Link to the data: https://www.kaggle.com/kenjee/ken-jee-youtube-data\nThis could be a great one to engage with on your #66daysofdata journey!', 'I’m new but I’ll give it a try over summer, college finishes in 3 weeks 🤝', 'Will perform some data analysis.  Thanks for it.', ""Ken,\n\nThanks for inspiring me to follow my passions through your content. I was working as a financial advisor and hated my life and you gave me the confidence i needed to make the leap and study data science. I'm almost done with my first project and owe a lot of my confidence to you. Keep it up!"", 'No I think not :pepe_hands:', 'How long do we have?', 'This is such a wonderful iniative! Looking forward to tinkering around with the data you have shared!', 'HI Ken! How about a video on how did you extract and arrange this data?', 'The keyword ""Papaya"" spikes view counts', ""Uni exams but I'm so excited about this!""]"
-2U2CMYom00,"['Wanted to add one additional thank you to everyone viewing or engaging with my content. So happy I could give back in any way possible!', '""Once you get to know him"" wow', 'I learn a lot abt data science through your videos thank u', 'YAY I get a shoutout :O Also do I get credit for lurking LOL', 'That hair cut looks great on you mate!', 'Wow ♥️ Nice work Ken Jee ♥️', ""Congratulations to all the winners🎉🎊  and thank you for the wishes ❤\n\nKen, I would like to like to say huge thanks to you for everything you have done for me till now. Honestly, you are like a catalyst for me to learn data science. At the start of 2021, I was just exploring things about data science and I came across your channel. Your content really helped me to move in a proper direction which is essential for me. The #66daysofdata is an amazing challenge that made me consistent to learn things. \r\n\r\n12 months of journey taught me many things and now I got a huge surprise from you which I can never forget and I will always be thankful and grateful to you. I really don't have words to express my happiness."", 'Good work Ken! And congrats to all the winners:)', 'Congratulations to all the winners! I love the way how you make your subscribers engaged with great contents and the appreciate them with prizes.', ""OMG This is such an amazing idea why haven't other channels tried this!!!!""]"
KEeUR8UDy-s,"['Thanks for watching everyone! Do you like data science related stories like this? Let me know other ones you would like me to deep dive into in the comments below!', ""one very important aspect that he acknowledges at the outset is that Happy Valley is a 'closed system' , meaning horses arrive on the island and stayed for the whole season (which was not that long, and they did not have races every night).  This certainly would have allowed him to better establish an accurate hierarchy (ie horse A has placed higher than horse B every time)  compared to the typical scenario of horses coming in, racing, and then off to another track (as happens in the US and UK).  Regarding suitability to today, you forget that the UK has Exchanges which operate differently than the Tote system Benter had to bet under.  The HK Jockey Club took out 18% off the top, and Benter still overcame that 'hole' and walked away a rich man.  The UK exchanges take out 1% plus a commission of 3-5% depending on who you bet with.  A much shallower hole to deal with."", 'Thanks Ken, very good video', 'The entry to Machine Learning and sports betting can be steep if you are not a coder, here is an easier way to gain an ML approach to sports betting https://youtu.be/PzdcwGLDifk', 'great content!\n\nsaudações from brazil o/', ""This is awesome. Honestly, I've always wanted to try sports betting lol (but to anyone reading, I didn't say that :P)"", 'Ken, have you ever attended the Sloan Analytics Conference in Boston?  A professional bettor that appeared on  the “Betting With an Edge.” Podcast and YouTube channel mentioned it.  He indicated it was a conference for the analytics folks from the American pro sports leagues.', ""I'm sorry and I don't mean to be rude or distract from your message because I truly respect and admire what do. But I've been a follower of yours for a while now, and I think you're really hot. ❤"", 'A quick note on Correlated/Colinear Features. These can be a huge pain for applications such as Sports Betting, where we are weighing certain factors relative to other factors. Concepts such as introducing dropout, random noise, and using clustering to engineer/select features might be helpful. Doing that would reduce the costs of running a model, improving ROIs even if drops absolute performance', 'Thanks Ken, this is superb story to share it my brother to introduce him to applications of ML in real world before data chaos']"
